control,question,answer
ISM-0027,	What are some ways in which system owners can protect systems and their resources?,"	System owners can ensure they have adequate protection by implementing appropriate controls such as access control, data encryption, auditing etc ISM-0027"
ISM-0039,What are some key components of a cybersecurity strategy?,The main component of any cybersecurity strategy is having strong policies and procedures for data protection. ISM-0039
ISM-0041,What are some examples of systems with a system security plan?,"Examples include computer networks, software applications, websites, databases, etc ISM-0041"
ISM-0041,	What are some examples of system specific security documents?,Examples include: ISM-0041
ISM-0042,"	What should an organization do to develop, implement and maintain system administration processes and procedures?",An organization should ensure that all system administration processes and procedures are documented in detail and followed by all employees involved with system administration tasks. ISM-0042
ISM-0042,What are some examples of system administration processes? ,"Examples include configuration management, change control, backup/recovery, security monitoring, etc - ISM-0042"
ISM-0042,What are some examples of system administration processes? ,"Examples include configuration management, change control, backup/recovery, security monitoring, incident handling, etc - ISM-0042"
ISM-0042,What are some examples of system administration processes? ,"Examples include configuring servers, managing user accounts, maintaining security policies, monitoring performance, etc - ISM-0042"
ISM-0047,What are the responsibilities of the CISO and SAO?,"The Chief Information Security Officer (CISO) approves organisational-level security documents, such as policies or standards, whereas the System Authorizing Officer (SAO) approves system-specific security documents, such as procedures or guidelines ISM-0047"
ISM-0047,	What are some examples of organisational level security documents?,Examples include: ISM-0047
ISM-0072,What security measures should be taken when outsourcing?,"When outsourcing services, it's important to have clear documentation about what security controls need to be implemented by your provider. These include ensuring that all data remains securely stored and protected from unauthorized access or modification, as well as having appropriate backup procedures in place so you can recover lost data if necessary. ISM-0072"
ISM-0100,	What does ISM stand for in this context?,The acronym 'ISM' stands for Information Security Management ISM-0100
ISM-0109,What does timely mean? ,"Timely means occurring or done at the right time, without delay - ISM-0109"
ISM-0120,How does one identify if there are any vulnerabilities in the system?,One way to identify potential vulnerabilities in the system is by using penetration testing techniques such as scanning or exploitation ISM-0120
ISM-0120,What are some key indicators of compromise? ,"Key indicators of compromise include unusual network traffic, unauthorized user activity, suspicious files or processes on computers, and other anomalies - ISM-0120"
ISM-0123,What should be done when cybersecurity incident occurs?,"When a cybersecurity incident occurs, it must be reported immediately to the organization's chief information security officer (CISO) or delegate for investigation and remediation ISM-0123"
ISM-0125,What are some of the benefits of having a cybersecurity incident register?,Having a cybersecurity incident register can help organizations identify potential threats before they occur by tracking past incidents. It also helps with compliance requirements as it provides evidence for audits and investigations. ISM-0125
ISM-0125,	What are some ways in which organizations can develop a cybersecurity incident register?,Organizations can develop a cybersecurity incident register by creating a list of all possible threats or attacks on information systems and networks. This will help them identify potential vulnerabilities and take necessary steps to prevent such attacks from occurring. ISM-0125
ISM-0133,How can organizations respond to cybersecurity incidents?,Organizations need to have incident management plans in place so they know how to handle different types of attacks or breaches. They also need to ensure that all employees understand what constitutes a threat and how to report it if necessary. ISM-0133
ISM-0133,What should you do when a data spill occurs? ,"When a data spill occurs, data owners are advised and access to the data is restricted - ISM-0133"
ISM-0137,	What are some ways in which organizations can respond to cybersecurity incidents?,"Organizations can respond to cybersecurity incidents by taking appropriate actions such as identifying the source of attack, analyzing the impact of the incident, notifying relevant authorities, implementing necessary countermeasures, and recovering from any damage caused due to the incident ISM-0137"
ISM-0138,	What are some ways in which you can ensure the integrity of evidence collected from a computer system?,	The first step would be to record every action taken while collecting data or information from a computer system. This will help establish a clear chain of custody as well as provide proof if any discrepancies arise later on. It also helps to follow all instructions given by the appropriate authorities when handling such cases. ISM-0138
ISM-0140,How can organizations report cybersecurity incidents to the Australian Cyber Security Centre (ACSC)?,Organizations can report cybersecurity incidents to the ACSC by contacting them through email or phone call ISM-0140
ISM-0161,What should be done with unused IT equipment? ,"Unused IT equipment should be stored securely, such as locked cabinets or rooms - ISM-0161"
ISM-0164,How can we prevent unauthorized people from observing system displays and keyboards within our facility?,We can use privacy screens on monitors or partitions between desk areas to prevent unauthorized people from viewing computer displays. ISM-0164
ISM-0181,What are some of the requirements for cabling infrastructure?,"The cabling infrastructure must be installed according to relevant Australian standards, as directed by the Australian Communications and Media Authority ISM-0181"
ISM-0181,	What are some cabling infrastructure standards?,Some cabling infrastructure standards include ISM-0181 ISM-0181
ISM-0206,"	What should an organization do to develop, implement and maintain cable labelling processes and procedures?","An organization should ensure that all cables are labelled properly with clear identification information such as name, location, purpose etc. ISM-0206"
ISM-0206,How can you support cable labelling procedures?,"You can provide training on how to use equipment for labelling cables, as well as create documentation outlining best practices. ISM-0206"
ISM-0206,What are some examples of cable labelling processes?,"Examples include colour coding, barcode printing, and label placement. ISM-0206"
ISM-0208,What does a Cable Register contain?,A Cable Register contains the following for each cable: ISM-0208
ISM-0208,	What are the components of a cable register?,The components of a cable register include: ISM-0208
ISM-0211,	What are some ways in which you can develop a cable register?,"	To create a cable register, it's important to document all cables used by your company. This includes both active and passive cables. You also need to keep track of where each cable runs so that they can easily be found if needed. ISM-0211"
ISM-0211,What is a Cable Register?,A Cable Register is a document used for recording all cables installed within a facility or network infrastructure. ISM-0211
ISM-0232,	What are some ways in which telephone systems can protect conversations?,	One way in which telephone systems can protect conversations is by using encryption. Encryption ensures that only authorized parties have access to information being transmitted through the system ISM-0232
ISM-0232,What are telephone systems used for sensitive or classified conversations?,Telephone systems used for sensitive or classified conversations encrypt all traffic that passes over external systems ISM-0232
ISM-0233,What type of communication should cordless telephones be used for?,"Cordless telephones can only be used for non-sensitive, unclassified conversations ISM-0233"
ISM-0236,	What does off-hook audio protection feature do?,It protects sensitive information from being heard by unauthorized parties when the phone line is not in use ISM-0236
ISM-0236,What does off-hook audio protection feature do?,It protects sensitive and classified calls from being overheard by unauthorized parties ISM-0236
ISM-0240,What types of communication should be avoided when sending sensitive or classified data?,"Sensitive or classified data should never be sent using paging, multimedia message service (MMS), short message service (SMS) or any other type of messaging app ISM-0240"
ISM-0245,What does direct connection mean?,"Direct connection refers to a communication channel between two devices without any intermediate components, such as routers and switches ISM-0245"
ISM-0245,	What should an organization do to plan for cyber security risks and manage cyber security business risks within their organisation.?,"An organization must develop a comprehensive risk management program that includes policies, procedures, processes, and controls to identify, assess, mitigate, monitor, and communicate information security threats and vulnerabilities in order to minimize potential damage resulting from attacks on its IT infrastructure ISM-0245"
ISM-0246,	What are some examples of emanations security threats?,"	Some examples include electromagnetic radiation (EMR), radio frequency interference (RFI) and electrostatic discharge (ESD). ISM-0246"
ISM-0250,	What are some examples of emanations security threats?,"Examples include malicious software, viruses, worms, spyware, adware, ransomware, phishing attacks, denial of service (DoS) attacks, man in the middle attacks, social engineering attacks, etc ISM-0250"
ISM-0250,What does ICT stand for? ,Information Communication Technology - ISM-0250
ISM-0252,What are some of the topics covered during cybersecurity awareness training?,"Some of the topics covered include phishing, social engineering attacks, password management, data protection, physical security, etc ISM-0252"
ISM-0258,	What are some examples of web proxy policies?,"Examples include blocking access to social media sites during work hours or restricting access to certain websites based on content type (e.g., pornography). ISM-0258"
ISM-0258,What are some steps involved in developing a web usage policy?,"The first step involves identifying what type of policies need to be created for your organization's website. Next you should create a list of all the rules and regulations that will govern how users interact with the site. Then you can begin drafting the actual document itself by writing down each rule as clearly as possible so there is no confusion about what is expected from employees or visitors. Finally, once the policy has been written it needs to be reviewed by legal counsel before being finalized and distributed throughout the company ISM-0258"
ISM-0258,What are some steps involved in developing a web usage policy?,"The first step involves identifying what type of policies need to be created for your organization's website. Next you should create a list of all the rules and regulations that will govern how users interact with the site. Then you can begin drafting the actual document itself by writing down each rule as clearly as possible. Finally, once it has been written, reviewed, edited, and approved, implement the new policy on your website so everyone knows about it ISM-0258"
ISM-0260,	What does ISM-0260 mean in this context?,"It means all web access, including that by internal servers, is conducted through web proxies ISM-0260"
ISM-0260,What does web proxy mean?,A web proxy is used for controlling and monitoring all internet traffic on a network ISM-0260
ISM-0261,What kind of data does a proxy log?,"A proxy logs information about websites visited, including IP addresses and timestamps ISM-0261"
ISM-0261,	What information does a web proxy log when accessing a website?,"	The web proxy logs the address, date and time, user, amount of data uploaded and downloaded, as well as the internal and external IP addresses ISM-0261"
ISM-0263,	What does ISM-0263 refer to in this context?,	ISM-0263 refers to Internet Service Management standard number 0263 ISM-0263
ISM-0264,	What are some examples of policies in an email usage policy?,Examples of policies include rules on sending emails outside the company network or using personal devices to send work related emails ISM-0264
ISM-0264,What are some steps involved in developing an email usage policy?,"The first step involves identifying stakeholders who will be affected by the new policy. Next, you should conduct research on existing policies at other organizations. Then, create a draft of your proposed policy and circulate it for feedback from all relevant parties. Finally, implement the final version of the policy and monitor its effectiveness over time ISM-0264"
ISM-0267,How do I access my email? ,You can use your approved browser or mobile device to access your email account - ISM-0267
ISM-0267,How do I access my email? ,You can use your approved browser or mobile device to connect to our secure portal for accessing your emails - ISM-0267
ISM-0267,	What are some examples of approved webmail services?,"	Examples include Gmail, Yahoo Mail, Outlook, etc ISM-0267"
ISM-0270,What does Protective Marking mean? ,"Protective Marking refers to the application of security controls on email content such as confidentiality, integrity, availability, etc., based on its level of sensitivity or classification - ISM-0270"
ISM-0270,	What does ISM-0270 mean in terms of email protection?,	It means that the content of this message contains sensitive information which requires special handling ISM-0270
ISM-0271,How can you ensure your email contains appropriate protection marks when sending sensitive information over email?,You can use a tool such as ISM-0271 which will help you add proper protections to your message ISM-0271
ISM-0271,What are some of the features of protective marking tools?,"Protective marking tools allow users to add security labels and classification marks to documents, such as Confidential or Top Secret. ISM-0271"
ISM-0272,What are some examples of protective markings? ,"Examples include Confidential, Restricted and Secret. - ISM-0272"
ISM-0272,	What are some examples of protective marking tools?,"Some examples of protective marking tools include ISM-0272, ISM-0315, ISM-0468 ISM-0272"
ISM-0285,What does Evaluated products refer to? ,The evaluated product refers to the item being tested or assessed for quality and performance - ISM-0285
ISM-0285,How can you ensure that your company's IT systems are secure from hackers?,"By implementing strong passwords, using two factor authentication, updating software regularly, backing up data on a regular basis, keeping antivirus updated, installing firewalls, monitoring network traffic, restricting access to sensitive information, training employees about phishing attacks etc ISM-0285"
ISM-0289,What does control mean? ,Control refers to the ability of an organization or individual to direct or manage something - ISM-0289
ISM-0289,How can you evaluate a product's performance?,"You can evaluate a product’s performance by comparing it against other similar products or benchmarking its speed, efficiency, reliability, etc., ISM-0289"
ISM-0289,What does control mean? ,"Control refers to the ability of an organization or individual to direct outcomes through planning, organizing, leading, and controlling resources - ISM-0289"
ISM-0293,	What are some examples of ICT equipment?,"Examples include computers, servers, laptops, tablets, smartphones, printers, scanners, routers, switches, firewalls, network cables, wireless access points, etc ISM-0293"
ISM-0294,What are some examples of sensitive data? ,"Sensitive data includes personal identifiable information (PII), financial records and intellectual property - ISM-0294"
ISM-0294,	What are some examples of high assurance ICT equipment?,"High Assurance ICT Equipment includes devices such as servers, routers, switches, firewalls, wireless access points, network storage systems, etc ISM-0294"
ISM-0298,	What are some best practices in system patching?,Some best practices in system patching include using a centralized and managed approach to ensure all patches/updates are applied correctly and confirming that they were successful. ISM-0298
ISM-0304,	What should an organization do when they stop supporting applications?,"When an application stops being supported, it means there will not be any more updates or bug fixes released for it. This can leave your system vulnerable to new threats as time goes on. It's important to remove unsupported apps from your systems so you don’t expose yourself to unnecessary risk ISM-0304"
ISM-0304,What does no longer supported mean? ,"When applications are not updated or maintained, they become unsupported and may be removed from use. - ISM-0304"
ISM-0305,What are some maintenance tasks for IT equipment?,"Some common maintenance tasks include replacing batteries, cleaning fans, checking cables, updating software, and ensuring proper ventilation ISM-0305"
ISM-0305,What are some maintenance tasks for IT equipment?,"Some common maintenance tasks include replacing batteries, cleaning fans, checking cables, updating software, and performing diagnostics ISM-0305"
ISM-0305,	What are some examples of cyber security strategies?,Examples include: ISM-0305
ISM-0306,	What are some of the responsibilities of an IT manager in an enterprise environment?,"An IT Manager's responsibility includes managing staff, planning budgets, developing policies, implementing new technology, maintaining existing systems, ensuring compliance with regulations, and providing support to end users ISM-0306"
ISM-0307,What should be done if an untrained person performs maintenance on IT equipment?,The IT equipment must be cleaned first ISM-0307
ISM-0310,What are some examples of ICT equipment? ,"Examples include computers, servers, routers and switches - ISM-0310"
ISM-0311,	What are some examples of ICT equipment?,"Examples include computers, laptops, tablets, smartphones, servers, routers, switches, printers, scanners, etc ISM-0311"
ISM-0311,What does sanitise mean? ,"To make something free of germs, bacteria and other contaminants - ISM-0311"
ISM-0313,What are some of the steps involved in developing ICT equipment sanitation processes?,"The first step involves identifying all relevant stakeholders who will be affected by the process. Next, you should conduct research on existing best practices for similar organizations. Then, create a plan with clear goals and objectives. Finally, implement your new process and monitor its effectiveness over time ISM-0313"
ISM-0316,	What are some examples of ICT equipment?,"Examples include computers, laptops, tablets, smartphones, servers, routers, switches, printers, scanners, monitors, keyboards, mice, cables, etc ISM-0316"
ISM-0316,What does it mean when ICT equipment has been released?,"When ICT equipment has been released, this means that it can be used by anyone without restriction and no longer requires any special permissions for use ISM-0316"
ISM-0317,What does control description mean? ,"Control description refers to instructions for controlling something, such as a process or system - ISM-0317"
ISM-0318,What happens when you cannot sanitize your printer cartridge? ,The cartridge will be destroyed as it contains sensitive data - ISM-0318
ISM-0323,	What does ISM-0323 mean in this context?,"It means that all media must be classified according to its content, regardless of whether it contains more sensitive information than what it was originally intended to store ISM-0323"
ISM-0325,	What does this policy mean?,This policy means that any media (such as USB drives) connected to a computer with a higher level of classifications will also have those same levels of classifications applied to it ISM-0325
ISM-0330,What is the control for before reclassifying media?,Sanitation or destruction of the media followed by a formal administrative decision ISM-0330
ISM-0330,	What are some examples of media that can be reclassified from higher to lower sensitivity levels?,"Examples include unclassified information such as publicly available data, open source intelligence, and non-sensitive personal information ISM-0330"
ISM-0332,	What are some examples of internal media in IT equipment?,"Internal media can include hard drives, memory cards, flash drives, CDs/DVDs etc ISM-0332"
ISM-0336,What are some examples of ICT equipment? ,"Examples include computers, servers, routers, switches, printers, etc - ISM-0336"
ISM-0337,What does control mean? ,Control refers to the ability of a system to access and use media containing sensitive data. - ISM-0337
ISM-0337,	What does ISM-0337 mean in this context?,It means that media can only be used on systems that have been approved by the government to handle sensitive information ISM-0337
ISM-0341,How do I enable automatic execution of files on my USB drive?,"To enable automatic execution of files on your USB drive, you need to turn off the Automatic Execution feature under Control Panel > System and Security > Windows Firewall > Advanced Settings ISM-0341"
ISM-0343,	What are some ways in which you can secure your computer from malware attacks?,"	There are many different methods available to protect yourself against malicious programs on your computer. Some of these include using antivirus software, keeping all operating systems up to date with patches, avoiding suspicious websites, not clicking on links sent through email unless they have been verified as safe, and ensuring that any downloaded files come from trusted sources ISM-0343"
ISM-0343,What are some ways to disable removable media?,One way to prevent unauthorized access to removable media is through the use of device access control software. Another method is to disable external communication interfaces on computers and other devices ISM-0343
ISM-0345,	What does device access control software do?,It allows you to restrict access to devices on your network ISM-0345
ISM-0347,	What are some examples of write once media?,"Examples include CDs, DVDs, USB drives, floppy disks ISM-0347"
ISM-0348,What are some examples of media sanitization processes?,"Examples include removing sensitive data from images or videos, filtering out profanity, and blocking offensive content ISM-0348"
ISM-0348,"	What should an organization do to develop, implement and maintain media sanitation processes and procedures?","An organization should develop, implement and maintain media sanitation processes and procedures by developing policies and standards, conducting risk assessments, training employees on proper handling of sensitive information, monitoring compliance with established policies and standards, and reviewing existing practices regularly ISM-0348"
ISM-0348,What are some examples of media sanitization processes?,"Examples include removing sensitive data from images or videos, encrypting files, and deleting unnecessary metadata ISM-0348"
ISM-0350,	What should an organization do to plan for cyber security risks and manage cyber security business risks within their organisation.?,"An organization must develop a comprehensive risk management framework which includes policies, procedures, processes, tools and techniques in order to identify, assess, mitigate and monitor cybersecurity threats and vulnerabilities. ISM-0350"
ISM-0351,What does it mean when volatile media is sanitized?,"When volatile media is sanitized, all of its power sources are removed for at least ten minutes ISM-0351"
ISM-0351,	What are some examples of volatile media?,"Examples of volatile media include RAM, hard drives, flash memory devices, etc ISM-0351"
ISM-0354,	What should an organization do to plan for cyber security risks and manage cyber security business risks within their organisation.?,"An organization must develop a comprehensive risk management program which includes identifying threats, vulnerabilities, impacts, controls, and mitigation strategies. ISM-0354"
ISM-0357,	What should an organization do to plan for cyber security risks and manage cyber security business risks within their organisation.?,"An organization must develop a comprehensive risk management framework which includes identifying threats, vulnerabilities, impact analysis, mitigation strategies, monitoring and reporting. ISM-0357"
ISM-0359,	What are some examples of non-volatile flash memory media?,"Examples include USB drives, SD cards, SSDs ISM-0359"
ISM-0361,	What are some methods used in data destruction?,"Some methods used in data destruction include shredding, degaussing, incineration, pulverization, and overwriting ISM-0361"
ISM-0362,What should I do if product specific instructions for my degausser are not clear?,"If you cannot find any clarification on how to use your degausser, contact the manufacturer directly and ask them for further guidance ISM-0362"
ISM-0362,How can you destroy hard drives securely?,Hard drive data can be destroyed using several methods such as physical destruction or degaussing. Physical destruction involves shredding or crushing the device while degaussing uses magnetism to erase all information on the disk. ISM-0362
ISM-0363,What are some examples of media destruction processes? ,Examples include shredding paper documents or burning CDs/DVDs - ISM-0363
