control,question,answer
ISM-1221,How do you check if there's a paper jam? ,"Check for any signs of paper jams, such as unusual sounds or lights on the printer/MFD. - ISM-1221"
ISM-1223,	What are some ways to protect your computer from malicious software attacks?,"	There are many different methods you can use to protect yourself against malicious software attacks on your computer. Some of these include installing antivirus programs, keeping all operating systems up to date with patches, avoiding suspicious websites or emails, not clicking links inside unsolicited messages, and being careful when downloading files online ISM-1223"
ISM-1225,What is the control description for sending a fax?,"The paper tray of the fax machine is removed, and a fax message with a minimum length of four pages is transmitted, before the paper tray is re-installed to allow a fax summary page to be printed. ISM-1225"
ISM-1226,What does no pages are trapped mean?,It means there are no papers stuck inside the fax machine's paper feeding system ISM-1226
ISM-1227,	What should you do when setting up credentials for user accounts?,	You should use random passwords with a minimum length of eight characters ISM-1227
ISM-1228,What is the purpose of cybersecurity?,"The primary goal of cybersecurity is to protect data and systems from unauthorized access, disruption or destruction by malicious actors ISM-1228"
ISM-1233,	What is the name of the protocol used in key exchange during establishment of IPSec connection?,The name of the protocol used in key exchange during establishment of IPSec connection is ISM-1233 IKE version 2 ISM-1233
ISM-1233,What does IKE stand for? ,Internet Key Exchange - ISM-1233
ISM-1234,What are some examples of potentially harmful content? ,"Examples include malicious links, phishing attempts, spam emails, viruses, etc - ISM-1234"
ISM-1234,How can you implement email content filtering on your network?,Implementing email content filtering involves configuring the mail server with filters that block certain types of messages from being delivered or stored on the system. ISM-1234
ISM-1235,What add-on should I use with my browser?,You can try using Google Chrome Extensions or Mozilla Firefox Add-Ons ISM-1235
ISM-1237,What does web content filtering mean? ,"It refers to the process of restricting access to certain websites or types of online content, such as pornography and violent material - ISM-1237"
ISM-1237,What does web content filtering mean? ,"It refers to the process of restricting access to certain websites or types of online content, such as pornography and other objectionable material - ISM-1237"
ISM-1237,How can you use web content filters in your network?,You can apply web content filters on outbound web traffic ISM-1237
ISM-1238,	What is threat modeling?,	Threat Modeling is a process whereby potential threats are identified and analyzed so as to determine how they can affect your system or product. ISM-1238
ISM-1239,	What are some examples of robust web application frameworks?,"	Some examples of robust web application frameworks include Django, Flask, Pyramid, Tornado, Falcon, CherryPy, TurboGears, Pylons, Twisted, Bottle, and WSGI. ISM-1239"
ISM-1240,What does validation mean? ,"It means checking if data entered into a system meets certain criteria, such as being within acceptable ranges of values - ISM-1240"
ISM-1240,	What are some examples of validation or sanitation techniques used in web applciations?,"Examples include: - Strip out any special characters from user inputs (e.g., <, >, &) - Check if the length of the string is valid - Ensure that only numbers can be entered into numeric fields ISM-1240"
ISM-1241,	What is ISM-1241 Output Encoding?,	ISM-1241 Output Encoding is used in web applications to encode data before it is sent out as part of the HTTP response ISM-1241
ISM-1243,	What are some examples of databases?,"Examples of databases include MySQL, PostgreSQL, MongoDB, Oracle, SQL Server, SQLite, MariaDB ISM-1243"
ISM-1245,What happens when all temporary installation files and logs created during server application installations are removed?,"The system will be free of unnecessary data, which can help improve performance ISM-1245"
ISM-1249,What does it mean for server applications to be configured to run as a separate account?,"It means they will have access only to resources necessary to complete their tasks, and no more than that ISM-1249"
ISM-1250,What does it mean when you say The accounts under which server applications run have limited access to their underlying server's file system?,"It means that the account running on the server has restricted permissions and cannot modify or delete files from its own directory, but can only read them. ISM-1250"
ISM-1250,	What are some ways in which you can restrict privileges for server applications?,	Restricting privileges for server applications involves limiting the permissions granted to users or groups on files and directories. This includes setting appropriate permissions on all critical files and folders as well as ensuring that only necessary services are running with administrative rights ISM-1250
ISM-1255,How can you protect your databases from unauthorized modification or removal?,"You can restrict user's ability to access, insert, modify and remove data by implementing proper authorization controls ISM-1255"
ISM-1255,What are some of the restrictions placed on database users?,"Users' ability to access, insert, modify or delete data from databases is restricted according to their job roles. ISM-1255"
ISM-1256,How can you protect your databases from unauthorized access?,You can apply file based access control on database files ISM-1256
ISM-1260,"What happens when default accounts or credentials for server applications, including for any pre-configured accounts, are changed?","When default accounts or credentials for server applications, including for any pre-configured accounts, are changed, it may cause unexpected behavior and errors on the system ISM-1260"
ISM-1263,What is unique privilege account? ,Unique privileged accounts are used for administering individual server applications - ISM-1263
ISM-1268,	What are some ways in which organizations can protect data stored on databases?,"Organizations can use various methods such as applying minimum privilege, using database views and creating database roles to enforce the need-to-know principle ISM-1268"
ISM-1270,	What is the purpose of placing database servers in a separate network from other devices?,The purpose of separating database servers into a separate network is to prevent unauthorized access by users or malicious software. ISM-1270
ISM-1271,What is a network access control?,A network access control (NAC) is a security policy used to regulate traffic between computers on a network. ISM-1271
ISM-1271,	What are some examples of network access controls?,"Examples include firewalls, intrusion detection systems (IDS), virtual private networks (VPNs) ISM-1271"
ISM-1272,	What are some common network environments used by databases?,"Some common network environments used by databases include LANs (Local Area Network), WLANs (Wireless Local Area Network) and VPNs (Virtual Private Network). ISM-1272"
ISM-1272,What does it mean if only local access to a database is required?,It means that no remote connections are allowed and all data must be accessed from within the same network as the server. ISM-1272
ISM-1273,What are development and testing environments? ,"Development and testing environments are used for developing, testing, and debugging software applications before they go into production - ISM-1273"
ISM-1274,What does this control mean?,This means that database content from production environments should only be used for development and testing if they have been secured at the same level of protection as the production environment ISM-1274
ISM-1275,What does this control do? ,This control filters all queries to databases from web applications for legitimate content and correct syntax - ISM-1275
ISM-1276,	What is parameterized query in web applications?,	Parameterized query is a type of SQL statement which allows you to pass parameters into your query so it can return different results based on those values ISM-1276
ISM-1276,What is parameterized query? ,It is a type of SQL statement that allows you to pass parameters into your query and use them as variables within it - ISM-1276
ISM-1277,What does control mean? ,Encrypted data communication - ISM-1277
ISM-1277,	What are some common types of attacks on databases?,"	Some common types of attacks on databases include SQL injection, denial of service (DoS), buffer overflows, and privilege escalation ISM-1277"
ISM-1278,How can web developers improve database interactions in order to reduce errors?,Developers need to ensure they have sufficient knowledge of the data structures used by the system so that they can design interfaces which minimize the risk of errors ISM-1278
ISM-1278,What does it mean when web apps are designed with minimal error info?,"When web apps are designed with minimal error info, they do not display any errors on their interface and instead return generic messages such as Error occurred or Internal Server Error. ISM-1278"
ISM-1284,What does content validation mean? ,Content validation refers to checking whether files are free of errors and meet certain standards before they can be processed by systems - ISM-1284
ISM-1284,	What does ISM-1284 refer to in this context?,	ISM-1284 refers to International Standardization Management - 1284 ISM-1284
ISM-1286,	What does content conversion mean in context with content filtering?,	Content Conversion refers to converting data from one format into another format so it can be used by different systems ISM-1286
ISM-1287,	What does ISM-1287 refer to in this context?,	It refers to the International Standardization Management standard number 1287 ISM-1287
ISM-1289,	What does ISM-1289 refer to?,	It refers to the standard number of the document which specifies how archive files can be imported/exported through gateways or Content Delivery Services (CDS). ISM-1289
ISM-1290,	What does archive files mean?,	Archive files refer to data stored on archival media such as tape drives or optical disks ISM-1290
ISM-1290,What does controlled mean? ,"Controlled means done with care and precision, without causing damage or harm - ISM-1290"
ISM-1293,	What does ISM-1293 refer to?,	ISM-1293 refers to the International Standardization Measurement standard number 1293 ISM-1293
ISM-1293,What happens when encrypted files are imported/exported through gateways and CDS?,"When encrypted files are imported or exported through gateways or CDS, they will be automatically decrypted so that they can undergo content filtering checks ISM-1293"
ISM-1294,What does partially verified mean? ,"Partial verification means that data transfers have been reviewed and confirmed as accurate, but not all of them were checked. - ISM-1294"
ISM-1294,	What does partially verified mean in this context?,Partial verification means that only some aspects of the log were checked while others may not have been reviewed or audited. ISM-1294
ISM-1296,What are some examples of physical security? ,"Examples include locks, cameras and alarms - ISM-1296"
ISM-1296,	What are some examples of facilities and systems used by organizations to secure data?,"Examples include firewalls, intrusion detection system (IDS), antivirus software, encryption, etc ISM-1296"
ISM-1297,What are some of the risks associated with allowing private mobile devices to access company networks?,"Allowing personal devices to connect to corporate networks can pose several security threats, including malware and viruses, loss of sensitive data, and unauthorized access by third parties. ISM-1297"
ISM-1297,	What are some examples of legal advice that can be given when using private mobile devices in workplace environments?,"Some examples include ensuring employees understand what information they have access to on company networks, how it may be used, and who has access to it; establishing policies around use of personal devices at work; and educating employees about best practices for protecting sensitive information while working remotely ISM-1297"
ISM-1298,	What are some of these risks?,"Some of these risks include loss or theft of data, unauthorized access to information, malware infections, etc ISM-1298"
ISM-1299,	What should an organization do to plan for cyber security risks and manage cyber security business risks within their organisation.?,"An organization can develop a comprehensive risk management program which includes identifying threats, vulnerabilities, impacts, controls and mitigating actions. ISM-1299"
ISM-1300,	What should an organization do to plan for cyber security risks and manage cyber security business risks within their organisation.?,"An organization must develop a comprehensive risk management program which includes identifying threats, vulnerabilities, impacts, controls, and mitigation strategies. ISM-1300"
ISM-1311,	What is the use of Simple Network Management Protocol (SNMP)?,"The Simple Network Management Protocol (SNMP) is used in network management systems to monitor network devices such as routers, switches, servers etc., ISM-1311"
ISM-1314,What does Wi-Fi Alliance Certified mean? ,It means all wireless devices have been tested and approved by the Wi-Fi Alliance - ISM-1314
ISM-1314,	What does ISM stand for in ISM-1314?,"The letter 'I' stands for Industrial, while 'S' represents Scientific, and 'M' means Medical. ISM-1314"
ISM-1315,	What are some common features of wireless access point administration interfaces?,"Some common features of wireless access point administration interfaces include user authentication, password management, device configuration, and firmware updates ISM-1315"
ISM-1316,	What is the default setting for WPA2 encryption on WiFi devices?,The default setting for WPA2 encryption on WiFi devices is TKIP (Temporal Key Integrity Protocol). ISM-1316
ISM-1317,What does SSID stand for? ,Service Set Identifier - ISM-1317
ISM-1317,	What does ISM-1317 mean in this context?,	It refers to the International Standardization Management System (ISMS) standard number 1317 ISM-1317
ISM-1318,	What are some default settings in WLANs?,Some default settings in WLANs include: ISM-1318
ISM-1318,What does it mean when SSID Broadcasting is enabled? ,"When SSID Broadcasting is enabled, your Wi-Fi network's name (or Service Set Identifier) will be sent out over the airwaves so other devices can detect and connect to it - ISM-1318"
ISM-1319,	What are some advantages of using static addressing in wireless networks?,	Static addressing provides more control over network traffic as it allows administrators to assign specific IP addresses to devices. ISM-1319
ISM-1319,What is static addressing? ,"It's a method of assigning IP addresses on wired networks, but it isn't used for assigning IP addresses on wireless networks - ISM-1319"
ISM-1320,	What are some common types of attacks on WLANs?,	The most common type of attack on WLANs is Man in the Middle (MITM) attack wherein the hacker intercepts data between two legitimate users by posing as a trusted network access point ISM-1320
ISM-1321,	What are some advantages of using 802.1x authentication over WEP or WPA2?,The main advantage of using 802.1x authentication over WEP or WPA2 is that it provides stronger encryption than either one. ISM-1321
ISM-1322,	What is the purpose of using 802.1x authentication protocols?,The purpose of using 802.1x authentication protocols is to provide secure network access control by verifying user identity before allowing them to connect to the network ISM-1322
ISM-1323,	What is certificate?,	Certificate is used to authenticate a device or user on a network ISM-1323
ISM-1324,	What is the purpose of generating and issuing certificates in wireless network?,The purpose of generating and issuing certificates in wireless networks is to provide secure communication between devices by authenticating users and ensuring data integrity ISM-1324
ISM-1327,	What are some examples of logical access control methods used in wireless networks?,"Examples include password protection, biometric identification, and two factor authentication ISM-1327"
ISM-1330,What does PMK caching period mean?,It refers to how long a Wi-Fi network will cache its Pre-Shared Key (PSK) before it expires and needs to be reentered by users ISM-1330
ISM-1330,How can you configure WPA2 Enterprise with EAP-TLS on Windows Server 2016?,You need to install the Active Directory Certificate Service role in order to use EAP-TLS. ISM-1330
ISM-1332,How does ISM-1332 WPA3-Enterprise 192-bit mode protects the confidentiality and integrity of all wireless network traffic?,ISM-1332 WPA3-Enterprise 192-bit mode uses advanced cryptographic algorithms such as GCMP (Galois/Counter Mode) and SAE (Simultaneous Authentication of Equals). These algorithms provide strong encryption with forward secrecy which ensures data privacy even if the key is compromised in future ISM-1332
ISM-1332,What does WPA3-Enterprise 192-bit mode mean?,It means that this security protocol uses strong encryption algorithms to ensure the confidentiality and integrity of all wireless network traffic ISM-1332
ISM-1334,	What are some ways in which interference can occur on wireless networks?,	Interference can occur when two or more devices use the same frequencies at the same time. ISM-1334
ISM-1335,How can you secure your network against unauthorized users?,"You can implement strong passwords, two factor authentication, firewalls, intrusion detection systems (IDS), and anti-virus software ISM-1335"
ISM-1335,What does the 802.11w amendment do?,The 802.11w amendment enables wireless access points to protect management frames from being intercepted by unauthorized devices ISM-1335
ISM-1338,What is the control? ,Deploying a large number of low-powered wireless access points instead of few powerful ones - ISM-1338
ISM-1338,	What does ISM-1338 mean in this context?,	It means Institute of Electrical and Electronics Engineers (IEEE) Standard 802.11b/g/n ISM-1338
ISM-1341,	What are some examples of host based intrusion prevention systems (HIPS)?,Some examples of host based intrusion prevention systems include: ISM-1341
ISM-1359,What are some steps for developing a removable media usage policy?,"The first step of creating a removable media usage policy is to identify what data will be stored on removable devices. Next, you should determine which users have access to these devices and how they can use them. Finally, create a written document outlining your policies and procedures so everyone knows exactly what's expected from them when using removable storage devices. ISM-1359"
ISM-1359,	What are some examples of removable media devices?,"Examples of removable media include USB drives, CDs/DVDs, SD cards, external hard disks etc ISM-1359"
ISM-1361,	What are some examples of approved equipment for media destruction?,	ISM-1361 Security Construction and Equipment Committee-approved equipment or ASIO-approved equipment ISM-1361
ISM-1361,What type of equipment should be used for destroying media?,Control description: Security Construction and Equipment Committee-approved equipment or ASIO-approved equipment is used when destroying media ISM-1361
ISM-1364,	What are some advantages of using virtual local area networks (VLAN)?,Some advantages of using VLAN include: ISM-1364
ISM-1366,When do security updates get released? ,As soon as they become available - ISM-1366
ISM-1369,	What is the purpose of using AES-GCM in transport layer security?,The purpose of using AES-GCM in transport layer security is to provide confidentiality and integrity protection for data transmitted over networks ISM-1369
ISM-1369,What is AES-GCM?,AES-GCM (Advanced Encryption Standard with Galois/Counter Mode) is a symmetric key block cipher and is used for encrypting data transmitted over TLS connections ISM-1369
ISM-1370,	What does server-initiated mean in this context?,Server-initiated means that only the server can initiate a secure connection with another party. ISM-1370
ISM-1370,What does Only server-initiated secure renegotiation mean?,"It means that only the server can initiate a secure connection with another party, and it must be done over encrypted channels ISM-1370"
ISM-1373,What does Anonymous DH mean? ,"It means that no anonymous key exchange protocols are being used, such as Diffie-Hellman (DH). - ISM-1373"
ISM-1373,	What is anonymous DH?,	Anonymous Diffie Hellman (DH) is a key exchange protocol which allows two parties to establish a shared secret over an insecure channel without having to first agree on a common encryption algorithm or key length. ISM-1373
ISM-1374,What is SHA-2? ,It's a hashing algorithm used by SSL/TLS protocols - ISM-1374
ISM-1374,	What is Transport Layer Security (TLS)?,	Transport Layer Security (TLS) is a protocol designed by Netscape Communications Corporation in 1995 as part of its suite of security offerings. It was originally known as Secure Sockets ISM-1374
ISM-1375,	What is the purpose of using HMAC in SSL/TLS protocols?,The purpose of using HMAC in SSL/TLS protocols is to provide authentication between two parties communicating over a network ISM-1375
ISM-1375,What is SHA-2?,SHA-2 is used for the Hash-based Message Authentication Code (HMAC) and pseudorandom function (PRF) for TLS connections ISM-1375
ISM-1380,	What are some examples of privilege separation in system administration?,"	Some examples include using different accounts for administrative tasks such as user management or configuration changes, running processes with limited privileges, and isolating critical systems from less secure ones ISM-1380"
ISM-1380,What does Privileged Users mean? ,"It refers to people who have access to sensitive data or resources, such as administrators of systems - ISM-1380"
ISM-1381,	What are some examples of administrative infrastructures?,"Examples include Active Directory, DNS, DHCP, LDAP, NTP, Samba, SSH, SNMP ISM-1381"
ISM-1385,	What are some examples of administrative infrastructures?,"Examples include Active Directory, DNS servers, DHCP servers, etc ISM-1385"
ISM-1386,	What are some examples of network management traffic?,"Examples include monitoring, troubleshooting, configuration changes, etc ISM-1386"
ISM-1386,What does network management mean? ,"The process of monitoring and controlling network resources, such as routers or switches - ISM-1386"
ISM-1387,	What does ISM-1387 refer to in this context?,	ISM-1387 refers to the administrative infrastructure used by the system administrator ISM-1387
ISM-1388,	What are some examples of administrative activities?,"Examples include adding users or groups, changing passwords, resetting accounts, etc ISM-1388"
ISM-1388,What are some examples of assets that require administrative actions?,"Examples include computers, printers and other network devices ISM-1388"
ISM-1389,	What does ISM-1389 refer to?,	It refers to the standard number of the document which defines the requirements for content filtering. ISM-1389
ISM-1389,What does executed in a sandbox mean?,"It means running code inside of a restricted environment, with limited access and resources, for security purposes ISM-1389"
ISM-1392,	What are some examples of application controls?,Examples of application controls include: ISM-1392
ISM-1392,What are some examples of application controls?,"Application controls include access control, authentication, auditing, encryption, logging, monitoring, patch management, and vulnerability scanning ISM-1392"
ISM-1395,	What are some contractual security requirements with service providers?,Some contractual security requirements include ensuring that all parties involved in providing the service have adequate policies and procedures in place to protect sensitive information. ISM-1395
ISM-1401,	What is multi-factor authentication (MFA)?,"	Multi-Factor Authentication (MFA) is a method of confirming user identity using two or more factors such as knowledge factor, possession factor, inherence factor etc., ISM-1401"
ISM-1402,	What should an organization do to protect its credentials from unauthorized access?,An organization can use a password manager to store passwords securely. ISM-1402
ISM-1403,	What is account lockout?,An account lockout occurs when a user tries to access his/her account but fails multiple times due to incorrect password or other reasons ISM-1403
ISM-1404,	What happens when unprivileged access to systems or applications are suspended due to inactivity?,"When unprivileged access to systems or applications are suspended due to inactivity, users will not have access to those systems until they log back into them again ISM-1404"
ISM-1404,What happens if I don't log into my account for more than 45 days?,Your unprivileged access will be automatically disabled ISM-1404
ISM-1405,What is the purpose of implementing a centralized event logging facility?,"The purpose of implementing a centralized event logging facility is to ensure all events are logged immediately, so that administrators can quickly identify any issues or problems with their system ISM-1405"
ISM-1406,	What is standard operating environment (SOE)?,	Standard operating environments (SOEs) are predefined configurations of hardware and software settings on computers or devices. They provide a consistent user experience across multiple machines and platforms ISM-1406
ISM-1409,	What are some ways to implement ISM-1409 ACSC and vendor guidance to help with OS hardening?,"Implementing ISM-1409 ACSC and vendor guidance can include configuring firewalls, disabling unnecessary services, restricting access to administrative accounts, enabling strong passwords, implementing encryption, and using anti-virus software ISM-1409"
