control,question,answer
ISM-1622,What does Constrained Language Mode mean? ,It means that all commands must be written using only valid PowerShell syntax - ISM-1622
ISM-1622,How can you configure PowerShell to use constrained language mode?,You can configure PowerShell to use constrained language mode by using the -CommandMode parameter with the Set-ExecutionPolicy cmdlet ISM-1622
ISM-1622,What does Constrained Language Mode mean? ,"It means that only certain commands are allowed, and all other commands will be ignored - ISM-1622"
ISM-1623,What are some features of PowerShell?,"PowerShell has several useful features including module logging, script block logging and transcription functionality ISM-1623"
ISM-1623,	What are some ways in which you can configure PowerShell to log its activities?,"	PowerShell can be configured to log its activities by using module logging, script block logging and transcription functionality ISM-1623"
ISM-1624,How can you protect your PowerShell scripts from being logged in event viewer?,You can use the -NoLog parameter when running the command ISM-1624
ISM-1625,What are some of the benefits of implementing a trusted insider program?,Implementing a trusted insider program can help reduce security risks by limiting access to sensitive data only to those who need it for their job functions. ISM-1625
ISM-1625,	What are some examples of a trusted insider program?,Examples include: ISM-1625
ISM-1626,	What are some best practices when developing a trusted insider program?,"	The first step in creating a trusted insider program is to identify what data will need protection. Next, it's important to determine who has access to this information and how they can use it. Finally, you must decide on the appropriate level of monitoring required to ensure compliance with your policies. ISM-1626"
ISM-1626,What are some considerations when developing a trusted insider program?,"When creating a trusted insider program, it's important to take into account factors such as employee privacy concerns, legal compliance requirements, and security risks associated with employees having access to sensitive data. ISM-1626"
ISM-1627,What does this control do?,"This control blocks incoming traffic from anonymous networks, such as Tor and VPNs, to prevent malicious actors from accessing sensitive data on Internet facing systems ISM-1627"
ISM-1627,How can you block anonymous inbound network connection on your firewall?,You can use IP address filtering or DNS blacklisting to prevent access to certain websites ISM-1627
ISM-1629,	What is the purpose of selecting a modulus when using DH for agreeing on encryption session keys?,The purpose of selecting a modulus when using DH for agreeing on encryption session keys is to ensure that the key generated by both parties will match so they can use it to encrypt data securely ISM-1629
ISM-1630,	What is the purpose of generating a modulus when using DSA for digital signatures?,The purpose of generating a modulus when using DSA for digital signatures is to ensure that the signature can only be verified by someone who has access to the private key used in signing it ISM-1630
ISM-1632,What applications should be used for choosing suppliers?,"Supply chain management software can help you choose suppliers based on factors such as cost, quality, reliability, and more. ISM-1632"
ISM-1632,What applications should be used for choosing suppliers?,"Supply chain management software can help you choose suppliers based on factors such as cost, quality, reliability, and environmental impact ISM-1632"
ISM-1633,	What are some examples of types of systems?,Examples include: ISM-1633
ISM-1634,	What are some examples of controls used by system owners to protect systems and their resources?,"Examples include access control, data encryption, network segmentation, etc ISM-1634"
ISM-1635,	What are some examples of controls that can be used by system owners to protect systems and their resources?,"Examples include access control, data encryption, network segmentation, etc ISM-1635"
ISM-1636,What are some examples of control descriptions?,"Examples include ensuring systems are configured securely, monitoring access logs, implementing strong authentication mechanisms, etc ISM-1636"
ISM-1636,	What does it mean by systems?,"Systems refer to any hardware or software used in performing tasks such as computers, servers, networks etc ISM-1636"
ISM-1637,	What are some examples of managed services and cloud services?,"Managed Services include IT infrastructure management, network monitoring, data backup and recovery, help desk support, and disaster recovery planning. Cloud services provide access to software applications over the internet without having to install them locally ISM-1637"
ISM-1637,What are some of the benefits of using an outsourced cloud service registry?,Outsourcing your cloud services can help you save time and money by allowing you to focus on other areas of your business while still maintaining control over your data. ISM-1637
ISM-1638,What are some of the benefits of using an outsourced cloud service?,"Outsourcing your IT services can help you save time and money, as well as improve efficiency by allowing you to focus on core business activities. ISM-1638"
ISM-1638,	What are some examples of managed services and cloud services?,"Managed Services include IT infrastructure management, network monitoring, help desk support, application hosting, storage management, disaster recovery planning, and more. Cloud services provide access to software applications over the internet on demand without having to install them locally. ISM-1638"
ISM-1640,What does labelled mean? ,Labelled means marked with words or symbols - ISM-1640
ISM-1641,	What are some methods used in data destruction?,"Some methods used in data destruction include shredding, degaussing, incineration, pulverization, and crushing ISM-1641"
ISM-1641,What does deformed mean? ,Deformation refers to physical damage caused on magnetic media when it has been exposed to strong magnets or electromagnetic fields - ISM-1641
ISM-1642,How can you sanitize media before reuse?,You can sanitise media by wiping or degaussing it using approved methods ISM-1642
ISM-1643,	What are software registers used for in system management?,"Software registers are used to keep track of version numbers and patch history of various components such as application, driver, OS and firmware ISM-1643"
ISM-1643,What are software registers?,"Software registers contain versions and patch histories of applications, drivers, operating systems and firmware ISM-1643"
ISM-1644,What precautions should be taken when conducting sensitive or classified phone calls?,"When conducting sensitive or classified phone calls, it's important to take steps to ensure your conversation cannot be overheard by others. This includes avoiding public places and using headphones if necessary. ISM-1644"
ISM-1645,What does Floor Plan Diagrams mean?,A floor plan diagram shows the layout of a building or room with dimensions and other details such as furniture placement ISM-1645
ISM-1646,	What are some examples of cabling infrastructures?,"Some examples of cabling infrastructures include copper cables, fiber optics, wireless networks, and power lines ISM-1646"
ISM-1647,	What are some examples of suspending access to systems or services?,"Examples include disabling accounts, revoking permissions, locking out users from accessing certain areas, etc ISM-1647"
ISM-1647,What happens if privilege access isn't re-enabled within 12 months?,The user will be unable to log into any system or application until their privileges are manually restored by an administrator ISM-1647
ISM-1648,What happens if my privilege is not used for more than 45 days?,Your privilege will be automatically disabled. ISM-1648
ISM-1648,	What are some examples of suspending access to systems or services?,"Examples include disabling accounts, locking out users from accessing certain areas, restricting access to specific data, etc ISM-1648"
ISM-1649,	What are some ways in which privilege can be managed on a system?,	Privileges can be managed by using just-in-time administration or least privilege. ISM-1649
ISM-1649,What is just-in-time administration?,Just-in-time administration is used for administering systems and applications ISM-1649
ISM-1650,What type of event is logged? ,Privileged account and group management events - ISM-1650
ISM-1651,Where can I find privileged access event logs? ,They are stored on the central server - ISM-1651
ISM-1651,Where can I find privileged access event logs? ,The privileged access event logs are stored centrally on the server - ISM-1651
ISM-1653,What does it mean when a privileged account is restricted?,A privileged account is restricted if it cannot access certain resources such as the Internet or email. ISM-1653
ISM-1654,	What are some ways in which you can secure your computer against malware attacks?,"	Some ways to secure your computer from malware include using antivirus software, keeping all applications up to date, avoid downloading files from untrusted sources, use strong passwords, and keep your firewall enabled ISM-1654"
ISM-1656,How can application control be implemented on non-internet facing servers?,Non internet facing servers are protected by implementing application controls such as restricting access to certain applications or services based on user identity ISM-1656
ISM-1657,What does application control do?,"It restricts the execution of executable files, software libraries, scripts, installers, compiled HTML, HTML apps and control panel applets to an organization approved list ISM-1657"
ISM-1657,	What are some examples of application controls?,Some examples of application controls include: ISM-1657
ISM-1658,What does application control do? ,It restricts the execution of drivers to an organization-approved set - ISM-1658
ISM-1658,	What are some examples of application controls?,"Some examples of application controls include whitelisting, blacklisting, sandboxing, and virtualization ISM-1658"
ISM-1659,What does 'Microsoft's recommended driver block rules' mean?,"It means that all drivers should be blocked from accessing certain websites and services, such as social media or gaming sites ISM-1659"
ISM-1659,	What is application control?,Applications control refers to controlling access to applications on your computer or network. It can help prevent malicious software from running by blocking it at the source ISM-1659
ISM-1660,	What is application control?,	Application Control allows you to specify which applications can run on your computer or network. ISM-1660
ISM-1661,	What is application control?,	Application Control allows you to specify which applications can run on your computer or network. ISM-1661
ISM-1662,	What does this statement mean?,This statement means that all allowed and blocked execution events on non-internet facing servers will be logged ISM-1662
ISM-1663,Where can I find application control event logs? ,The application control event logs are stored centrally on the server - ISM-1663
ISM-1663,How can you ensure application controls are working properly in your operating systems?,Ensure that all applications have been installed from trusted sources and that they are up to date with patches ISM-1663
ISM-1664,What does Blocked PowerShell script execution events mean?,It means that any attempts to execute PowerShell scripts will be blocked and recorded as an event log entry. ISM-1664
ISM-1664,How can you block PowerShell script execution in Windows Server 2019?,You can use the Group Policy Editor to configure blocking PowerShell script execution on your server by enabling the Block all scripts policy setting under Computer Configuration -> Administrative Templates -> System -> Scripts (Windows PowerShell). ISM-1664
ISM-1665,Where can I find my Windows Event Logs? ,"The Windows Event Logs are located on your computer's centralized server, which you can access by using the command prompt and typing eventvwr. - ISM-1665"
ISM-1665,Where can I find my Windows Event Logs? ,"The Windows Event Logs are located on your computer's centralized server, which you can access by using the command prompt or PowerShell. - ISM-1665"
ISM-1665,How can you configure Windows Event Logs in PowerShell?,You can use the Get-WinEvent command to retrieve events from the local computer or remote computers on your network. ISM-1665
ISM-1666,Why doesn't Internet Explorer 11 process content from the internet?,It may be due to a network issue or browser settings. ISM-1666
ISM-1666,	What are some ways in which you can prevent your browser from processing content from the internet?,	You can disable JavaScript or enable clickjack protection on your browser settings ISM-1666
ISM-1667,Why does Microsoft Office block creation of child processes?,"To prevent malicious software from running on your computer, Microsoft blocks applications like Microsoft Office from creating child processes ISM-1667"
ISM-1667,	What are some examples of user application hardening techniques?,"	Some examples include blocking access to certain websites or applications, disabling unnecessary services, restricting administrative privileges, etc ISM-1667"
ISM-1668,	What are some ways in which you can secure your computer against malware attacks?,"	There are many different methods available to protect yourself online such as using antivirus software, keeping all operating systems up to date with patches, avoid clicking on suspicious links or attachments, use strong passwords, and keep personal information private ISM-1668"
ISM-1668,Why does my computer block Microsoft Office from creating executable content?,Your computer blocks Microsoft Office from creating executable content because it may contain malicious code or viruses. ISM-1668
ISM-1669,	What are some ways in which you can secure your computer against malware attacks?,"	There are many different methods available to protect yourself from malicious software such as antivirus programs, firewalls, anti-spyware tools, etc. ISM-1669"
ISM-1670,Why does my PDF software not create any child processes?,"Your PDF software may be blocked by your operating system or security settings, preventing it from creating new processes. ISM-1670"
ISM-1670,	What are some examples of user application hardening techniques?,"	Some examples include blocking unneeded services or ports, disabling unnecessary features, restricting access to sensitive data, limiting privileges, etc ISM-1670"
ISM-1671,What does Microsoft Office macros are disabled mean?,"It means that macros cannot be used by those who don't need them, as they pose security risks and can cause harmful effects on computers ISM-1671"
ISM-1672,How can you prevent malicious code from executing in your computer system?,By using anti-virus software with real time protection capabilities ISM-1672
ISM-1672,Is my computer protected from viruses? ,"Yes, your computer has been configured with Microsoft Office macro virus protection - ISM-1672"
ISM-1673,	What is user application hardening?,User Application Hardening refers to the process of securing applications by reducing vulnerabilities in order to prevent unauthorized access or malicious attacks on systems ISM-1673
ISM-1674,	What does this policy mean?,"This policy means that only Microsoft Office macros running from within a sandboxed environment, a Trusted Location or that are digitally signed by a trusted publisher are allowed to execute ISM-1674"
ISM-1675,How do I enable a macro from an unknown source?,"You can't, as it may contain malicious code and could compromise your system security. ISM-1675"
ISM-1675,	What are some ways in which user applications can be hardened?,"	Some ways in which user applications can be hardened include disabling unnecessary features, restricting access to certain files, limiting privileges, removing unwanted software, and updating regularly ISM-1675"
ISM-1676,What does validated mean? ,Validated means verified as accurate and reliable - ISM-1676
ISM-1676,	What are some ways in which user applications can be hardened?,"	Some ways in which user applications can be hardened include restricting access to sensitive data by using encryption techniques such as hashing algorithms, implementing strong passwords with regular password changes, disabling unused accounts, limiting administrative privileges, and enabling multi-factor authentication ISM-1676"
ISM-1678,How can you prevent malicious code from executing on your computer when using Microsoft office macros?,You can disable all macros in MS Word by going into Tools > Options > Trust Center > Macro Security > Disable All Macros ISM-1678
ISM-1679,What is multi-factor authentication?,Multi-factor authentication (MFA) is a security system that requires more than one method of verification from different categories before granting access to a user. ISM-1679
ISM-1679,	What are some examples of multi-factor authentication?,"Some examples include biometrics (e.g., fingerprint), one time password tokens, smart cards, SMS messages with PIN codes, etc ISM-1679"
ISM-1680,What is multi-factor authentication?,"Multi-factor authentication (MFA), also known as two-step verification, is a security system that requires more than one method of authentication from independent categories of credentials to verify the user's identity for login and access approval. ISM-1680"
ISM-1680,	What are some examples of multi-factor authentication?,"Some examples include using a password along with a fingerprint scan, voice recognition, facial recognition, etc ISM-1680"
ISM-1681,	What are some examples of multi-factor authentication?,"Some examples include biometrics such as fingerprint scanning or facial recognition, SMS verification codes sent via phone number, one time passwords generated on physical tokens, etc ISM-1681"
ISM-1681,What does multi-factor authentication do?,"It adds another layer of security when logging into accounts, requiring more than one method of verification before allowing access ISM-1681"
ISM-1682,	What are some examples of multi-factor authentication?,"Some examples of multi-factor authentication include biometrics such as fingerprints or facial recognition, SMS verification codes, one time passwords (OTP), and hardware tokens ISM-1682"
ISM-1685,What credentials should be used for local admin accounts?,"Long, unique, unpredictable and managed ISM-1685"
ISM-1686,What does Windows Defender Credential Guard do? ,"It protects your credentials by isolating them from malware, preventing attackers from stealing or modifying them - ISM-1686"
ISM-1686,How can you protect your credentials from being stolen by hackers?,Enable two factor authentication on all accounts where possible ISM-1686
ISM-1688,	What are some examples of separate privileged operating environments?,	Some examples include: ISM-1688
ISM-1688,What does unprivileged mean? ,An account with no special permissions or access rights - ISM-1688
ISM-1689,What does this control mean?,"This means privileged accounts, such as domain administrators and service accounts, are not allowed to access non-administrative systems or services. ISM-1689"
ISM-1689,	What are some examples of separate privileged operating environments?,Examples include: ISM-1689
ISM-1690,When should patches and updates be applied?,"Within two weeks of release, or within 48 hours if an exploit exists ISM-1690"
ISM-1690,	When to patch security vulnerabilities?,Security vulnerability patches must be installed as soon as possible after they become available. ISM-1690
ISM-1690,What is the control?,Applying patches and updates to internet facing services ISM-1690
ISM-1691,	When to patch security vulnerabilities?,Security vulnerability patches should be installed as soon as they become available ISM-1691
ISM-1692,	When to patch security vulnerabilities?,Security vulnerability patches should be installed as soon as they become available ISM-1692
ISM-1693,	When to patch security vulnerabilities?,Security vulnerability patches should be installed as soon as possible after they become available ISM-1693
ISM-1693,When should patches and updates be applied? ,Within one month of release - ISM-1693
ISM-1694,	When to patch security vulnerabilities?,Security vulnerability patches must be installed as soon as possible after they become available. ISM-1694
ISM-1695,When should patches be installed? ,Within 2 weeks after their release - ISM-1695
ISM-1695,	When to patch security vulnerabilities?,Security vulnerability patches must be installed as soon as possible after they become available. ISM-1695
ISM-1696,	When to patch security vulnerabilities?,Security vulnerability patches must be installed as soon as possible after they become available. ISM-1696
ISM-1696,What is the control?,"Applying patches, updates or vendor mitigations for security vulnerabilities in operating systems of workstations, servers and network devices within 48 hours if an exploit exists ISM-1696"
ISM-1697,	When to patch security vulnerabilities?,Security vulnerability patches should be installed as soon as possible after they become available ISM-1697
ISM-1697,When should patches be released?,"Within two weeks of release, or within 48 hours if an exploit exists ISM-1697"
ISM-1698,	What are some ways to scan for missing patches or updates on systems?,"Some ways to scan for missing patches or updates include using a vulnerability scanner, running regular system checks, and reviewing logs regularly ISM-1698"
ISM-1698,What are some examples of internet facing services?,"Examples include web servers, email servers and databases ISM-1698"
ISM-1699,What are some examples of vulnerable applications?,"Examples include Microsoft Office Suite (Word, Excel), Adobe Acrobat Reader, Google Chrome Browser, Mozilla Firefox Browser, Apple Safari Browser, Thunderbird Email Client, Outlook Email Client, Gmail Email Client, Yahoo Mail Email Client, Skype Chat Application, Dropbox File Sharing Service, etc ISM-1699"
ISM-1699,	What are some ways to scan for missing patches or updates?,"Some ways to scan for missing patches or updates include using a vulnerability scanner, running regular system checks, and checking with your vendor about available updates ISM-1699"
ISM-1700,	What are some ways to scan for missing patches or updates on your system?,	Using a vulnerability scanner can help you find out if there are any missing patches or updates on your system. ISM-1700
ISM-1700,What are some examples of software vulnerabilities?,"Examples include buffer overflows, cross-site scripting (XSS), SQL injection and denial of service attacks ISM-1700"
ISM-1701,	What are some best practices for system patching?,Some best practices for system patching include using a vulnerability scanner on a regular basis to scan for missing patches or updates for security vulnerabilities in operating systems of Internet facing services. ISM-1701
ISM-1701,What are some examples of internet facing services?,"Examples include web servers, email servers and databases ISM-1701"
ISM-1702,	What are some ways to scan for missing patches or updates on your system?,	Using a vulnerability scanner is one way to scan for missing patches or updates on your system. ISM-1702
ISM-1702,What are some examples of vulnerabilities?,"Examples include buffer overflows, cross-site scripting (XSS), SQL injection attacks, and denial of service (DoS) attacks ISM-1702"
ISM-1703,	What are some ways to scan for missing patches or updates on your system?,	Using a vulnerability scanner such as Tenable Nessus can help you find out if there are any missing patches or updates on your system. ISM-1703
ISM-1703,What is a Vulnerability Scanner?,"A vulnerability scanner is a tool used by system administrators to detect potential weaknesses on their network, such as unpatched software or outdated hardware. ISM-1703"
ISM-1705,Can privileged accounts access backups?,"No, they can't access backups belonging to other accounts ISM-1705"
ISM-1705,	What are some best practices for data backup and restoration?,	Backing up your data regularly is one of the most important steps in protecting it from loss or corruption. It's also essential when recovering from ransomware attacks. ISM-1705
ISM-1706,	What are some best practices for data backup and restoration?,	Backing up your data regularly is one of the most important steps in protecting it from loss or corruption. It's also critical to ensure you have a reliable way to restore your files if they become damaged or lost. ISM-1706
ISM-1706,Can privileged accounts access their own backups?,"No, privileged accounts are not allowed to access their own backups ISM-1706"
ISM-1707,What privileges does a privileged account have?,A privileged account has access to modify or delete backups ISM-1707
ISM-1708,What does this control do?,"This control prevents privileged users, including backup administrators, from modifying or deleting backups while they're retained for compliance purposes ISM-1708"
ISM-1710,How can you secure your WiFi network from unauthorized users?,You can use WPA2 encryption with strong passwords or enable MAC address filtering ISM-1710
ISM-1711,What does User Identity Confidentiality mean? ,It means protecting user identities from being revealed when using EAP-TLS authentication - ISM-1711
ISM-1711,	What are some methods used in wireless network authentication?,"Some methods used in wireless network authentication include WPA/WPA2 Enterprise, PEAP (MSCHAPv2), LEAP, TTLS, EAP-FAST, EAP-SIM, EAP-AKA, EAP-TTLS, EAP-PWD, EAP-MD5, EAP-GTC, EAP-PEAP, EAP-TLS, EAP-SAKE, EAP-SIM, EAP-AKA, EAP-SUITE, EAP-IKEV2 ISM-1711"
ISM-1712,	What does ISM-1712 mean in wireless networking?,	ISM-1712 refers to the IEEE standard for fast basic service set transition which allows devices on a network to quickly switch between access points without losing connectivity ISM-1712
